{
  "$schema": "https://json-schema.org/draft/2020-12/schema",
  "title": "UserUpdateRequest",
  "type": "object",
  "properties": {
    "displayName": {
      "type": "string"
    },
    "givenName": {
      "type": "string"
    },
    "surname": {
      "type": "string"
    },
    "jobTitle": {
      "type": "string"
    },
    "department": {
      "type": "string"
    },
    "officeLocation": {
      "type": "string"
    },
    "mobilePhone": {
      "type": "string"
    },
    "businessPhones": {
      "type": "array"
    },
    "streetAddress": {
      "type": "string"
    },
    "city": {
      "type": "string"
    },
    "state": {
      "type": "string"
    },
    "postalCode": {
      "type": "string"
    },
    "country": {
      "type": "string"
    },
    "preferredLanguage": {
      "type": "string"
    },
    "accountEnabled": {
      "type": "boolean"
    },
    "usageLocation": {
      "type": "string"
    }
  }
}