{
  "displayName": "example_value",
  "givenName": "example_value",
  "surname": "example_value",
  "jobTitle": "example_value",
  "department": "example_value",
  "officeLocation": "example_value",
  "mobilePhone": "example_value",
  "businessPhones": [],
  "streetAddress": "example_value",
  "city": "example_value",
  "state": "example_value",
  "postalCode": "example_value",
  "country": "example_value",
  "preferredLanguage": "example_value",
  "accountEnabled": true,
  "usageLocation": "example_value"
}